{
  "$schema": "./schemas/cv-schema.json",
  "personalInfo": {
    "firstName": "Nazmi Yücel",
    "lastName": "Çan",
    "title": "Machine Learning Engineer",
    "profileImage": "images/profile.png",
    "location": "Giresun, Türkiye (Open to Relocation / Remote)"
  },
  "professionalSummary": "Machine Learning Engineer specializing in model development, optimization, and edge AI deployment. Reduced mT5 SLM model size 5x (from 500MB to 100MB) via pruning, 8-bit LoRA, and INT8 quantization. Following computer vision experience, currently focusing on Natural Language Processing (NLP). Co-authored a research paper published in El-Cezeri Journal (2026). Developed Zettelkasten AI Notes (Pupilica AI Hackathon Top 10 Finalist), featuring a Two-Tier Vector RAG pool, CPU cross-encoder reranking, and Vulkan GPU local GGUF inference.",
  "skills": [
    {
      "category": "Programming Languages",
      "skill_list": [
        "Python (Advanced)",
        "SQL",
        "Bash/Shell Scripting"
      ]
    },
    {
      "category": "ML & AI Frameworks",
      "skill_list": [
        "TensorFlow",
        "PyTorch",
        "Keras",
        "Scikit-learn",
        "Hugging Face (LoRA/PEFT)",
        "ONNX Runtime",
        "llama-cpp-python"
      ]
    },
    {
      "category": "Core Domains",
      "skill_list": [
        "Computer Vision (OpenCV, YOLOv8)",
        "NLP (Transformers, RAG & Embeddings)",
        "Data Preprocessing & Evaluation",
        "Model Optimization (Quantization & Pruning)",
        "MLOps Fundamentals"
      ]
    },
    {
      "category": "Tools & Platforms",
      "skill_list": [
        "Git/GitHub",
        "Linux (Ubuntu/Debian)",
        "PyQt5",
        "Flet",
        "Google Gemini API"
      ]
    }
  ],
  "education": [
    {
      "degree": "Bachelor of Science",
      "field": "Information Systems and Technologies",
      "institution": "Burdur Mehmet Akif Ersoy University",
      "startYear": "09/2022",
      "endYear": "06/2026",
      "gpa": "3.17/4.00"
    }
  ],
  "experiences": [
    {
      "title": "Machine Learning Intern",
      "company": "Deep Think Technology",
      "startDate": "02/2026",
      "endDate": "06/2026",
      "description": [
        "Developed the industrial \"Apple Detection and Quality Analysis System\", integrating real-time YOLOv8-seg fruit detection, CIEDE2000 color quality analysis, physical dimension measurement, and camera SDK into a unified PyQt5 desktop application.",
        "Trained and deployed computer vision models on embedded devices for real-time edge AI inference.",
        "Implemented data preprocessing and model evaluation workflows for edge computing hardware, addressing real-world latency and resource constraints."
      ]
    }
  ],
  "languages": [
    {
      "language": "Turkish",
      "level": "Native"
    },
    {
      "language": "English",
      "level": "Upper-Intermediate"
    }
  ],
  "publications": [],
  "references": [
    {
      "name": "Asst. Prof. Dr. Nilgün ŞENGÖZ",
      "title": "Postdoctoral Researcher, Computer Science, University of Nottingham",
      "company": "Department of Information Systems & Technologies, MAKU, Türkiye",
      "email": "nilgunsengoz@mehmetakif.edu.tr",
      "phone": ""
    }
  ]
}