{
  "$schema": "../schemas/cv-schema.json",
  "personalInfo": {
    "firstName": "Nazmi Yücel",
    "lastName": "Çan",
    "title": "Junior Makine Öğrenimi Mühendisi",
    "profileImage": "images/profile.png",
    "location": "Türkiye (Taşınmaya Açık / Uzaktan Çalışabilir)"
  },
  "technicalProfile": "Model geliştirme, optimizasyon ve Edge AI sistemlerine odaklanan bir Junior Makine Öğrenimi Mühendisiyim. mT5 SLM model boyutunu budama, 8-bit LoRA ve INT8 kuantizasyon ile 5 kat küçülterek optimize ettim (500 MB'tan 100 MB'a). Görüntü işleme tecrübelerimin ardından güncel olarak Doğal Dil İşleme (NLP) alanına yöneliyorum. El-Cezeri Fen ve Mühendislik Dergisi'nde (2026) yayımlanan makalenin ortak yazarıyım; Pupilica Yapay Zeka Hackathonu'nda ilk 10 finalist arasına girdiğim Zettelkasten AI Notes projesinde iki kademeli vektör RAG havuzu, CPU cross-encoder yeniden sıralama ve Vulkan GPU hızlandırmalı yerel GGUF çıkarım mimarisi geliştirdim.",
  "skills": [
    {
      "category": "Programlama Dilleri",
      "skill_list": [
        "Python (İleri Seviye)",
        "SQL",
        "Bash/Shell Scripting"
      ]
    },
    {
      "category": "ML & Yapay Zeka Kütüphaneleri",
      "skill_list": [
        "TensorFlow",
        "PyTorch",
        "Keras",
        "Scikit-learn",
        "Hugging Face (LoRA/PEFT)",
        "ONNX Runtime",
        "llama-cpp-python"
      ]
    },
    {
      "category": "Temel Alanlar",
      "skill_list": [
        "Bilgisayarlı Görü (OpenCV, YOLOv8-seg)",
        "Doğal Dil İşleme - NLP (Transformers, RAG & Gömme)",
        "Veri Önişleme, Doğrulama & Veri Artırma (Augmentation)",
        "Model Optimizasyonu (Kuantizasyon, Budama, LoRA/PEFT)",
        "Edge AI & Çıkarım Optimizasyonu"
      ]
    },
    {
      "category": "Araçlar & Dağıtım",
      "skill_list": [
        "Git/GitHub",
        "Linux (Ubuntu/Debian)",
        "REST API & Model Servisleme Temelleri",
        "PyQt5",
        "Flet",
        "Google Gemini API"
      ]
    }
  ],
  "education": [
    {
      "degree": "Lisans",
      "field": "Bilişim Sistemleri ve Teknolojileri",
      "institution": "Burdur Mehmet Akif Ersoy Üniversitesi",
      "startYear": "09/2022",
      "endYear": "06/2026",
      "gpa": "3.17/4.00"
    }
  ],
  "experiences": [
    {
      "title": "Makine Öğrenimi Stajyeri",
      "company": "Deep Think Teknoloji",
      "startDate": "02/2026",
      "endDate": "06/2026",
      "description": [
        "Endüstriyel 'Elma Tespit ve Kalite Analizi Sistemi' için YOLOv8-seg örnek segmentasyonu (instance segmentation), aydınlatma değişimlerine dayanıklı CIEDE2000 renk farkı formülü ve fiziksel boyut ölçüm algoritmalarını endüstriyel kamera SDK'sı ile entegre ederek PyQt5 tabanlı uçtan uca masaüstü analiz mimarisini geliştirdim.",
        "Kaynak kısıtlı gömülü donanımlar üzerinde gerçek zamanlı uç çıkarım (Edge AI) elde etmek amacıyla YOLOv8-seg modelini eğittim; görüntü işleme hattındaki veri aktarım darboğazlarını optimize ederek canlı kamera akışında kesintisiz çıkarım sağladım.",
        "Endüstriyel kamera akışlarından elde edilen görüntülerin önişleme ve veri artırma (data augmentation) süreçlerini kurguladım; model doğrulama aşamalarını yürüterek zorlu aydınlatma koşullarında kararlı çalışmasını sağladım."
      ]
    }
  ],
  "projects": [
    {
      "title": "mT5 Çift Yönlü EN-TR Makine Çevirisi (ONNX INT8 & ORT Mobile)",
      "description": "Çift yönlü İngilizce-Türkçe makine çevirisi için mT5-small modeline 8-bit LoRA ile ince ayar (fine-tuning) yapılarak 0.6245 METEOR skoruna ulaşıldı. Sözlük budama (pruning), ONNX derleme ve INT8 kuantizasyon teknikleriyle model boyutu 5 kat küçültüldü (500 MB'tan 100 MB'a); ONNX Runtime (ORT Mobile) ile mobil ve kısıtlı kaynaklı cihazlar için optimize edildi.",
      "techStack": "Python, PyTorch, Transformers, LoRA, Fine-Tuning, ONNX Runtime, NLP",
      "slug": "mt5-en-tr-translation",
      "links": [
        {
          "label": "Kaggle",
          "url": "https://www.kaggle.com/code/n4yuc4/t5-model-based-machine-translation"
        }
      ]
    },
    {
      "title": "Zettelkasten Yapay Zeka Notları (Pupilica Yapay Zeka Hackathonu — İlk 10 Finalist)",
      "description": "Zettelkasten yöntemi etrafında Python ve Flet ile geliştirilmiş gizlilik odaklı masaüstü bilgi yönetim sistemi. Çift Yapay Zeka Motoru (Google Gemini ve Vulkan GPU hızlandırmalı yerel GGUF) üzerinde İki Kademeli Vektör RAG Havuzu, CPU cross-encoder yeniden sıralama (Qwen3) ve yerel gömme (Harrier-0.6B) ile kavram tekrarsız atomik not sentezi sunar. Etkileşimli kanvas zihin haritası, LaTeX destekli canlı Markdown editörü, çift yönlü WikiLink ve SQLite WAL kalıcılığı içerir.",
      "techStack": "Python, Flet, SQLite, RAG, llama.cpp, Gemini API, NLP",
      "slug": "zettelkasten-ai-notes",
      "links": [
        {
          "label": "GitHub",
          "url": "https://github.com/N4YuC4/ZettelKasten-AI-Notes"
        }
      ]
    },
    {
      "title": "Arduino PC System Monitor",
      "description": "PC donanım kaynaklarını (CPU, RAM, GPU, VRAM) izleyen ve güç tüketimini otomatik olarak optimize eden TinyML tabanlı uç sistem. Sistem, donanım telemetrisini gerçek zamanlı olarak çıkarır ve sistemin güç durumunu belirleyip ayarlamak için bir Arduino Leonardo üzerinde cihaz içi SVM sınıflandırma modeli çalıştırır.",
      "techStack": "Python, Arduino, TinyML, scikit-learn",
      "slug": "arduino-pc-system-monitor",
      "links": [
        {
          "label": "GitHub",
          "url": "https://github.com/N4YuC4/Arduino-PC-System-Monitor"
        }
      ]
    }
  ],
  "languages": [
    {
      "language": "Türkçe",
      "level": "Anadil"
    },
    {
      "language": "İngilizce",
      "level": "İleri-Orta Seviye"
    }
  ],
  "publications": []
}